[
  {
    "schema_version": "1.0",
    "call_id": "call-0001",
    "request_id": "req-0001",
    "practice_set_id": "ps-0001",
    "purpose": "generation",
    "attempt": 1,
    "is_fallback": false,
    "model_requested": "example/free-model:free",
    "model_used": "example/free-model:free",
    "provider": "example-provider",
    "tier": "free",
    "tokens_in": 2140,
    "tokens_out": 1630,
    "cost_usd": 0,
    "cost_source": "provider_reported",
    "latency_ms": 41200,
    "status": "ok",
    "item_ids": ["Q-PNE2025-PRI-MAT-DIAG-B1-A3-E2-3f9a1c20"],
    "started_at": "2026-10-21T14:05:00Z",
    "generation_id": "gen-example-1"
  },
  {
    "schema_version": "1.0",
    "call_id": "call-0002",
    "request_id": "req-0001",
    "practice_set_id": "ps-0001",
    "purpose": "generation",
    "attempt": 2,
    "is_fallback": true,
    "model_requested": "example/paid-model",
    "model_used": null,
    "provider": null,
    "tier": "paid",
    "tokens_in": null,
    "tokens_out": null,
    "cost_usd": null,
    "cost_source": "missing",
    "latency_ms": 0,
    "status": "budget_blocked",
    "started_at": "2026-10-21T14:06:00Z",
    "generation_id": null
  }
]
